{
  "type": "Resolution",
  "urn": "aesynth:gov:res/2025-11-01-ratify-human-constitution-1-0",
  "action": "ratify",
  "targets": [
    "aesynth:gov:doc/human-constitution@1.0.0"
  ],
  "issuedBy": "aesynth:gov:body/provisional-stewardship",
  "requiredBodies": [
    "aesynth:gov:body/provisional-stewardship"
  ],
  "minHumanReviewMinutes": 720,
  "quorum": "single-steward-clause",
  "vote": {
    "for": 1,
    "against": 0,
    "abstain": 0
  },
  "minutes": "docs/minutes/2025-11-01-jsa-provisional.md",
  "signatures": [
    {
      "actor": "aesynth:gov:actor/provisional-steward",
      "alg": "ed25519",
      "sig": null,
      "signedAt": "2025-11-01T05:07:22Z",
      "keyId": "did:key:z6MkProvisionalSteward"
    }
  ],
  "provenance": {
    "sha256": "a59e3096ad056822d9e1e64d90f56dfbbf748282414251ab9853a00e10af9395",
    "attestations": [
      "aesynth:gov:ledger/evt-000128"
    ]
  },
  "effectiveDate": "2025-11-01"
}
